{
  "$schema": "https://json-schema.org/draft/2020-12/schema",
  "$id": "https://schemas.ukma.dev/v1/code.analyze_impact.request.schema.json",
  "title": "code.analyze_impact Request (Phase 4 typed candidate)",
  "type": "object",
  "additionalProperties": false,
  "required": [
    "api_version",
    "operation",
    "context",
    "input"
  ],
  "properties": {
    "api_version": {
      "const": "1"
    },
    "operation": {
      "const": "ukma.code.analyze_impact.v1"
    },
    "context": {
      "$ref": "shared.schema.json#/$defs/RequestContext"
    },
    "input": {
      "type": "object",
      "additionalProperties": false,
      "properties": {
        "query": {
          "$ref": "shared.schema.json#/$defs/ImpactQuery"
        }
      },
      "required": [
        "query"
      ]
    }
  }
}
